{
  "schema_version": "1.0.0",
  "registry_id": "IDX_TRADE_DATA_SOURCE_PROVENANCE",
  "as_of": "2026-08-13",
  "source_count": 18,
  "checkpoint_count": 20,
  "controlling_checkpoints": [
    {"checkpoint_id":"TEAM_STATUS_MAIN","status":"CONTROLLING","repository":"samindriano/idx-trade","git_ref":"origin/main","commit":"97138a1f1569b9415c77dfb70ebce3ba39fc35ff","path":"coordination/TEAM_STATUS.md","blob_sha1":"2a4177166d756015d4549e2c40cf4be13db26be0","accepted_claims":["current ownership and source-boundary coordination"],"notes":"Canonical cross-chat coordination ledger; never a scientific authorization by itself."},
    {"checkpoint_id":"DATA_GATE_RUNBOOK","status":"CONTROLLING","repository":"samindriano/idx-trade","git_ref":"origin/main","commit":"3a7d7d4a47d9f69c9e285bf5c0b4292e392beed7","path":"docs/DATA_GATE_RUNBOOK.md","blob_sha1":"408b7936414492f29ee9507208f2e3309fd3e79c","accepted_claims":["official session and Stock Summary gate semantics"],"notes":"Exchange-session truth and execution-evidence rules."},
    {"checkpoint_id":"DATA_GATE_43_CERTIFIED","status":"CONTROLLING","repository":"samindriano/idx-trade","git_ref":"origin/data/idx-data-002c","commit":"788e1f61268344bf5b65eef8651b789e3a362f7f","path":"docs/checkpoints/2026-08-08_FULL_MARKET_43_SESSION_CERTIFIED.md","blob_sha1":"bd0643b1cfd546edfdd5ade1b2125177f7a16a83","accepted_claims":["bounded 43-session official market gate"],"notes":"Bounded certification only; not a complete historical PIT claim."},
    {"checkpoint_id":"DATA_GATE_1260_NO_GO","status":"CONTROLLING","repository":"samindriano/idx-trade","git_ref":"origin/data/idx-data-002c","commit":"4230699233a02500a4c17b7f2c25840baec6a9ee","path":"docs/checkpoints/2026-08-09_1260_RESEARCH_FEASIBILITY_NO_GO.md","blob_sha1":"38cc51c530592ae2a0c26441a77b7c3bcc469797","accepted_claims":["1260-session feasibility remains NO-GO"],"notes":"Preserves the unresolved historical completeness boundary."},
    {"checkpoint_id":"EOD_AUTOMATION_INSTALLED","status":"CONTROLLING","repository":"samindriano/idx-trade","git_ref":"origin/integration/forward-eod-automation-monitoring","commit":"ad2cceb3d16338471b6e6c4a51faedba15949a78","path":"docs/checkpoints/2026-08-13_FORWARD_EOD_AUTOMATION_INSTALLED.md","blob_sha1":"0869fc8a57eb11b0ba355678b36bba4008ee8b37","accepted_claims":["forward EOD automation is operational and outcome-blind"],"notes":"Operational forward capture; it does not establish historical PIT."},
    {"checkpoint_id":"OPEN_YAHOO_REVIEW","status":"CONTROLLING","repository":"samindriano/idx-trade","git_ref":"origin/data/idx-open-research-coverage-gate-v1","commit":"feae5bb4e9e6528c617309ef4de1c4eda2ee27b2","path":"docs/checkpoints/2026-08-11_OPEN_BACKFILL_YAHOO_CENSUS_INDEPENDENT_REVIEW.md","blob_sha1":"28c7e1acddbcd96f6fcac609eaa23fdf28bbbf0f","accepted_claims":["Yahoo raw OHLCV census and derivative Open boundary"],"notes":"Open derivatives remain research-use only and execution_grade_promoted=false."},
    {"checkpoint_id":"OPEN_COVERAGE_REVIEW","status":"CONTROLLING","repository":"samindriano/idx-trade","git_ref":"origin/data/idx-open-research-coverage-gate-v1","commit":"1d6709ecac589c7578b20b029041e125189d1ebc","path":"docs/checkpoints/2026-08-12_OPEN_RESEARCH_COVERAGE_GATE_INDEPENDENT_REVIEW.md","blob_sha1":"22bb3eded8a67070a8fab252b9b7bec7acc4d821","accepted_claims":["bounded OHLCV research common support"],"notes":"No execution-grade promotion and no new provider authorization."},
    {"checkpoint_id":"OPEN_WILDAN_REVIEW","status":"CONTROLLING","repository":"samindriano/idx-trade","git_ref":"origin/data/idx-open-research-coverage-gate-v1","commit":"6baf8b35a591c99a3a68f19a91d1d88d6588e128","path":"docs/checkpoints/2026-08-10_OPEN_BACKFILL_WILDAN_CHATGPT_REVIEW.md","blob_sha1":"099923f6d99372e8b7f875cf66f80c49a01a4931","accepted_claims":["Wildan Open recovery is not an accepted recovery source"],"notes":"HLC agreement did not produce accepted missing-Open fills."},
    {"checkpoint_id":"OPEN_TRADINGVIEW_REVIEW","status":"CONTROLLING","repository":"samindriano/idx-trade","git_ref":"origin/data/idx-open-research-coverage-gate-v1","commit":"9ffa1b9738f8fc77bd8fb8b29e3aed42ad6cd941","path":"docs/checkpoints/2026-08-11_ZAPI_TRADINGVIEW_TARGETED_CENSUS_INDEPENDENT_REVIEW.md","blob_sha1":"22b0b9d4a465157312122c897546db6f2c5b6d1b","accepted_claims":["targeted TradingView derivative Open candidates"],"notes":"Derivative application is bounded and does not mutate the immutable panel."},
    {"checkpoint_id":"ZAPI_OPEN_ACCEPTANCE","status":"CONTROLLING","repository":"samindriano/idx-trade","git_ref":"origin/data/zapi-source-acceptance-v1","commit":"1e8786286aa9c54cf4f0b645dcf963260562dcc6","path":"docs/checkpoints/2026-08-11_ZAPI_IDX_SOURCE_ACCEPTANCE_V1.md","blob_sha1":"5764884b81eedfa8986bca63054fc8d0b9884f22","accepted_claims":["Zapi is transport parity, not independent Open authority"],"notes":"Exact bounded parity did not authorize mass Open recovery."},
    {"checkpoint_id":"FOREIGN_FLOW_SOURCE_AUDIT","status":"CONTROLLING","repository":"samindriano/idx-trade","git_ref":"origin/data/foreign-flow-v1","commit":"193ccf85eb0f0115e9e1aa42c0e1aafe506a8461","path":"docs/checkpoints/2026-08-12_FOREIGN_FLOW_V1_SOURCE_AUDIT.md","blob_sha1":"c69753905daf7a0e9cdaa2a294283e565fc1fa9c","accepted_claims":["foreign-flow source and unit boundary"],"notes":"Official IDX source is usable for bounded audit; PIT publication timing is unresolved."},
    {"checkpoint_id":"FINANCIAL_PIT_SOURCE_AUDIT","status":"CONTROLLING","repository":"samindriano/idx-trade","git_ref":"origin/data/financial-pit-v1","commit":"b446c3cd6fbf057933202ae207d978b42edc5694","path":"docs/checkpoints/2026-08-12_FINANCIAL_PIT_V1_SOURCE_AUDIT.md","blob_sha1":"115234602678d5edb1627a9019f5da8c2059ab7f","accepted_claims":["financial PIT discovery boundary"],"notes":"Source discovery only; no complete immutable historical financial PIT acquisition."},
    {"checkpoint_id":"OWNERSHIP_KSEI_SOURCE_AUDIT","status":"CONTROLLING","repository":"samindriano/idx-trade","git_ref":"origin/data/ownership-ksei-v1","commit":"e3735b71ad14344ea5b2191622e7c926f65eaca7","path":"docs/checkpoints/2026-08-12_OWNERSHIP_KSEI_SOURCE_AUDIT.md","blob_sha1":"396505f4de347ee682e2e4acc1fcc3dcfc620adb","accepted_claims":["KSEI and official IDX ownership source boundary"],"notes":"Ownership parity does not establish PIT publication or free-float semantics."},
    {"checkpoint_id":"MARKET_INDEX_BREADTH_REVIEW","status":"CONTROLLING","repository":"samindriano/idx-trade","git_ref":"origin/data/market-index-breadth-history-v1","commit":"d3827f1506736ec64c957e10f50f5447196d9983","path":"docs/checkpoints/2026-08-12_MARKET_INDEX_BREADTH_INDEPENDENT_REVIEW.md","blob_sha1":"5c17e76bdcdb28cf24cc9edfd268f1829a264953","accepted_claims":["official index and market summary source boundary"],"notes":"Historical PIT timing and official breadth aggregates remain unresolved."},
    {"checkpoint_id":"PIT_SECTOR_HISTORY_REVIVAL","status":"CONTROLLING","repository":"samindriano/idx-trade","git_ref":"origin/data/idx-pit-sector-history-revival-v1","commit":"5c9cb42a9b40774a5672f7487ce46ad94a806bed","path":"docs/checkpoints/2026-08-13_PIT_SECTOR_HISTORY_REVIVAL_INDEPENDENT_REVIEW.md","blob_sha1":"833083cd96a27d067be21c14d3ddef70a6f27251","accepted_claims":["sector-history revival is 5 ready and 3 blocked"],"notes":"Reconciliation/index documents are not canonical issuer classification evidence."},
    {"checkpoint_id":"CORPORATE_ACTIONS_SOURCE_AUDIT","status":"CONTROLLING","repository":"samindriano/idx-trade","git_ref":"origin/data/corporate-actions-v1","commit":"83fe663594d1e10da257086c9f6fc9c36e0259b1","path":"docs/checkpoints/2026-08-11_CORPORATE_ACTIONS_V1_SOURCE_AUDIT.md","blob_sha1":"4738ee4ab1b931cf584e9c023a4520af2258b12b","accepted_claims":["corporate-action discovery and revision boundary"],"notes":"Record/publication dates are not automatically market-effective dates."},
{"checkpoint_id":"CORPORATE_ACTIONS_SPLIT_DIAGNOSTIC","status":"CONTROLLING","repository":"samindriano/idx-trade","git_ref":"origin/data/corporate-actions-v1","commit":"c66fc431a5af5f846dfdcd6abf9bf68f39c854f9","path":"docs/checkpoints/2026-08-12_CORPORATE_ACTIONS_V1_SPLIT_DIAGNOSTIC_FINAL.md","blob_sha1":"1da75ce975307cab32fa1ca7a1e9555eec846525","accepted_claims":["split diagnostic remains discovery-only"],"notes":"No automatic price adjustment or model use is authorized."},
    {"checkpoint_id":"STOCKBIT_INTRADAY_VERIFY","status":"CONTROLLING","repository":"samindriano/idx-trade","git_ref":"origin/integration/forward-eod-automation-monitoring","commit":"9cfb8abefe30e7a8b4c7300cae351beea4f61c36","path":"docs/checkpoints/2026-08-13_STOCKBIT_INTRADAY_2026-08-12_READ_ONLY_VERIFICATION.md","blob_sha1":"8e5dcd04fae024823eaebbaa81db1e4e529e4516","accepted_claims":["Stockbit intraday remains forward SHADOW"],"notes":"Not canonical EOD and no synthetic fill."},
    {"checkpoint_id":"BROKER_MARGIN_REVIEW","status":"CONTROLLING","repository":"samindriano/idx-trade","git_ref":"origin/data/broker-margin-source-audit-v0","commit":"c7fcec2a5fc58e503cf1ea5fbff9e890dcf827ae","path":"docs/checkpoints/2026-08-13_BROKER_MARGIN_SOURCE_LIVE_AUDIT_REVIEW.md","blob_sha1":"c5bbce9da7177b0fd6dc6375437bb07aac2fc87c","accepted_claims":["official Margin view accepted; margin-flow interpretation rejected"],"notes":"Semantics and PIT timing remain unresolved; no leverage/crowding feature."},
    {"checkpoint_id":"HISTORICAL_UNIVERSE_AUDIT","status":"CONTROLLING","repository":"samindriano/idx-trade","git_ref":"origin/data/historical-universe-v1","commit":"d447c640788e65c7322224820fa192fabf4dec9c","path":"docs/checkpoints/2026-08-11_HISTORICAL_UNIVERSE_V1_BOUNDED_LISTING_ACTIVITY_AUDIT.md","blob_sha1":"5e1c28b576ceaa2624c8a1097098dce91dc522ff","accepted_claims":["historical universe completeness is not established"],"notes":"Conflicting lifecycle examples remain unresolved; no complete window promoted."}
  ],
  "sources": [
    {